{
  "$schema": "https://json-schema.org/draft/2020-12/schema",
  "$id": "https://github.com/spring-projects-experimental/spring-boot-migrator/dep-kb/schema.json",
  "title": "Dependency upgrade impact record",
  "description": "Captures the API and behavior diff between two versions of a single Maven artifact, for use by the sbm-dep-tree / sbm-impact-map skills.",
  "type": "object",
  "required": [
    "schemaVersion",
    "groupId",
    "artifactId",
    "fromVersion",
    "toVersion",
    "researchedAt",
    "sources",
    "removed",
    "deprecated",
    "signatureChanges",
    "behaviorChanges",
    "configKeys"
  ],
  "additionalProperties": false,
  "properties": {
    "schemaVersion": {
      "type": "integer",
      "const": 1
    },
    "groupId": { "type": "string", "minLength": 1 },
    "artifactId": { "type": "string", "minLength": 1 },
    "fromVersion": { "type": "string", "minLength": 1 },
    "toVersion": { "type": "string", "minLength": 1 },
    "researchedAt": {
      "type": "string",
      "format": "date-time",
      "description": "ISO-8601 timestamp of when this record was produced or last refreshed."
    },
    "confidence": {
      "type": "string",
      "enum": ["high", "medium", "low"],
      "description": "Researcher's self-assessment. 'low' means sources were sparse or contradictory."
    },
    "sources": {
      "type": "array",
      "minItems": 1,
      "items": {
        "type": "object",
        "required": ["url"],
        "additionalProperties": false,
        "properties": {
          "url": { "type": "string", "format": "uri" },
          "title": { "type": "string" },
          "kind": {
            "type": "string",
            "enum": ["release-notes", "migration-guide", "changelog", "github-compare", "javadoc", "blog", "other"]
          }
        }
      }
    },
    "requiredJavaVersion": {
      "type": "string",
      "description": "Minimum JDK required by toVersion, if changed from fromVersion. Omit if unchanged."
    },
    "transitiveImpact": {
      "type": "array",
      "items": {
        "type": "object",
        "required": ["description"],
        "additionalProperties": false,
        "properties": {
          "description": { "type": "string" },
          "affectedPackages": {
            "type": "array",
            "items": { "type": "string" }
          }
        }
      },
      "description": "Notable changes to transitive dependencies, e.g. javax.* → jakarta.* package moves."
    },
    "removed": {
      "type": "array",
      "items": { "$ref": "#/$defs/symbolChange" },
      "description": "APIs that existed in fromVersion and are gone in toVersion."
    },
    "deprecated": {
      "type": "array",
      "items": { "$ref": "#/$defs/symbolChange" },
      "description": "APIs newly deprecated in this range (still callable, slated for removal)."
    },
    "signatureChanges": {
      "type": "array",
      "items": { "$ref": "#/$defs/symbolChange" },
      "description": "Methods or types whose signature changed (params, return type, throws, generics)."
    },
    "behaviorChanges": {
      "type": "array",
      "items": { "$ref": "#/$defs/symbolChange" },
      "description": "Same signature, different runtime behavior (defaults, ordering, exception types)."
    },
    "configKeys": {
      "type": "array",
      "items": {
        "type": "object",
        "required": ["key", "change"],
        "additionalProperties": false,
        "properties": {
          "key": { "type": "string" },
          "change": {
            "type": "string",
            "enum": ["removed", "renamed", "default-changed", "deprecated"]
          },
          "renamedTo": { "type": "string" },
          "note": { "type": "string" },
          "sourceUrl": { "type": "string", "format": "uri" }
        }
      },
      "description": "application.properties / application.yml key renames, removals, default changes."
    },
    "notes": {
      "type": "string",
      "description": "Free-form notes — gaps in source coverage, judgment calls, areas needing human review."
    }
  },
  "$defs": {
    "symbolChange": {
      "type": "object",
      "required": ["symbol"],
      "additionalProperties": false,
      "properties": {
        "symbol": {
          "type": "string",
          "description": "Fully-qualified symbol. Class: 'a.b.C'. Method: 'a.b.C#method(java.lang.String,int)'. Field: 'a.b.C#field'."
        },
        "kind": {
          "type": "string",
          "enum": ["class", "interface", "method", "constructor", "field", "annotation", "package"]
        },
        "detail": {
          "type": "string",
          "description": "Human-readable explanation (e.g. 'parameter type changed from String to CharSequence')."
        },
        "replacement": {
          "type": "string",
          "description": "Recommended replacement symbol, if any."
        },
        "sourceUrl": { "type": "string", "format": "uri" }
      }
    }
  }
}
